quote,book title,author
"“To constantly improve, and to be more resilient and adaptable, whenever there is a fork in the road, choose discomfort over comfort and you will grow.",The Motivation Myth,Jeff Haden
"If something goes wrong, don’t waste time complaining. Put that mental energy into making the situation better.",The Motivation Myth,Jeff Haden
"The most effective people apply the same framework to the decisions they make. “Will this help me reach my goal? If not, I won’t do it.”",The Motivation Myth,Jeff Haden
"If you feel like you’re constantly struggling to make decisions, take a step back. Think about your goals; your goals will help you make decisions.",The Motivation Myth,Jeff Haden
"The more goals you try to achieve at one time, the more questions you need to ask yourself.",The Motivation Myth,Jeff Haden
"Success is the result of rolling the dice a certain number of times. The more shots you take, the more chances you have of hitting the target.",The Motivation Myth,Jeff Haden
Highly accomplished people gain superior skills not by bursting through the envelope but by approaching and then slowly and incrementally expanding the boundaries of that envelope.,The Motivation Myth,Jeff Haden
"“I was under the impression that talent would lead to opportunity, but really, networking led to opportunity.",The Motivation Myth,Jeff Haden
Starting a business is the only way to have a chance to amass significant wealth.,The Motivation Myth,Jeff Haden
“Success is based on people first and strategy second.,The Motivation Myth,Jeff Haden
"Whenever possible, give the people around you the autonomy and independence to work the way they work best. When you do, they almost always find ways to do their jobs better than you imagined possible.",The Motivation Myth,Jeff Haden
"Without a meaningful goal to shoot for, work is just work.",The Motivation Myth,Jeff Haden
"realized that sometimes the easiest thing to compliment is the thing that people seem to want you to notice, or are obviously proud of:",The Motivation Myth,Jeff Haden
Research shows that more people leave a job due to a lack of recognition than for any other reason.,The Motivation Myth,Jeff Haden
"In fact, Joey thinks pressure is a privilege.",The Motivation Myth,Jeff Haden
You need a pro. All you have to do is choose people who have accomplished things that you wish to accomplish and follow their leads.,The Motivation Myth,Jeff Haden
Say you join an industry organization. Show up for every meeting. Contribute in small ways but otherwise lie low.,The Motivation Myth,Jeff Haden
Show that you recognize you’re new. Show that you don’t expect to be taken seriously until you prove you’re serious—and are in it for the long haul.,The Motivation Myth,Jeff Haden
"But once you’ve paid some dues, be smart and start small. Don’t ask for time or effort. Just ask a question.",The Motivation Myth,Jeff Haden
Stop comparing yourself with the people around you. Go see a superstar in action.,The Motivation Myth,Jeff Haden
"When you spend time with a superstar, when you try to do what the pros do, that experience will automatically ratchet your own internal limits to a higher level.",The Motivation Myth,Jeff Haden
we can’t all be great at everything. But we can be the best we can be at the things we choose to do.,The Motivation Myth,Jeff Haden
So that’s what I do. I find some way to be the best. It’s more fun for me and for the people I ride with.,The Motivation Myth,Jeff Haden
Ruthlessly evaluate every “opportunity” that comes your way.,The Motivation Myth,Jeff Haden
Spend all the time you can working on the area that drives real value for your business.,The Motivation Myth,Jeff Haden
everything you do “trains” the people around you to treat you a certain way.,The Motivation Myth,Jeff Haden
"Do this instead: Train, explain, trust . . . and remove yourself from processes where you don’t belong.",The Motivation Myth,Jeff Haden
Earlier we discussed how a twenty- or thirty-item to-do list is just a wish list.,The Motivation Myth,Jeff Haden
"Create an actual wish list. Write down all the ideas, projects, tasks, etc. you can think of. Make it a “would like to do” list.",The Motivation Myth,Jeff Haden
Then choose the three or four items from that list that will make the biggest difference.,The Motivation Myth,Jeff Haden
"Pick the easiest tasks to accomplish, or the ones with the biggest payoff, or the ones that will eliminate the most pain.",The Motivation Myth,Jeff Haden
The “1 percent advantage” works incredibly well for one simple reason: Small improvements add up to a major overall improvement.,The Motivation Myth,Jeff Haden
Research shows that the person you marry can have a dramatic impact on your job satisfaction and career success.,The Motivation Myth,Jeff Haden
"“Partner conscientiousness” predicted future job satisfaction, income, and likelihood of promotion, even after factoring in the participants’ level of conscientiousness.",The Motivation Myth,Jeff Haden
"Want a more successful relationship? Celebrate a little more. Empathize a little more. Worry a little more. In short, be a little more human.",The Motivation Myth,Jeff Haden
A few dollars an hour more won’t make you happy if you have to drive an extra hour every day to earn it.,The Motivation Myth,Jeff Haden
"economists determined that it takes a 40 percent increase in pay to make an additional hour of commuting time pay off, at least in terms of personal satisfaction and fulfillment.",The Motivation Myth,Jeff Haden
"“When a topic intrigues me, I become nearly obsessed,” she says.",How to Invest: Masters on the Craft,David M. Rubenstein
Much of life simply revolves around predicting the future and then taking actions that reflect the view of that future.,How to Invest: Masters on the Craft,David M. Rubenstein
"In the investment world, achieving a profit—to a lesser or greater degree depending on the type of investment—is the essence of investing.",How to Invest: Masters on the Craft,David M. Rubenstein
"investors—how were they able to predict the future, in their own area of investment, and how were they able to act well or not so well on those predictions?",How to Invest: Masters on the Craft,David M. Rubenstein
"Great investors tend to be relentless readers of books, magazines, newspapers, and curated materials that fit their interests.",How to Invest: Masters on the Craft,David M. Rubenstein
"They enjoy doing something others thought could not be done, or taking risks that might have been thought to be too great to take.",How to Invest: Masters on the Craft,David M. Rubenstein
great investors do not accept conventional wisdom;,How to Invest: Masters on the Craft,David M. Rubenstein
they see what others do not; and they are prepared to take the risk of being proven wrong by going against conventional wisdom.,How to Invest: Masters on the Craft,David M. Rubenstein
The ability to focus on the most important factors in an investment decision is one that great investors tend to have in common.,How to Invest: Masters on the Craft,David M. Rubenstein
excellent investors who tend to focus on the big picture—where is the economy going? Are interest rates going to be increased? Is inflation likely to increase?,How to Invest: Masters on the Craft,David M. Rubenstein
"They regard work as pleasure, and thus do not feel the need to ease up all that much as they age a bit.",How to Invest: Masters on the Craft,David M. Rubenstein
"They find investing a form of pleasure, and do not see a reason to reduce their pleasure",How to Invest: Masters on the Craft,David M. Rubenstein
"With investing, its raison d’être would appear to be almost always increasing the amount of money one has invested.",How to Invest: Masters on the Craft,David M. Rubenstein
"My view is that skillful investing, and thus skillful investors, perform an important role in allocating capital to companies or projects that perform valuable social purposes.",How to Invest: Masters on the Craft,David M. Rubenstein
"Capitalism has its flaws, for sure. It increasingly and sadly seems to be leaving people behind as it marches forward.",How to Invest: Masters on the Craft,David M. Rubenstein
But that should not diminish the reality that just the practice of investing carries a valuable social purpose:,How to Invest: Masters on the Craft,David M. Rubenstein
"to develop a unique and complex skill (i.e. investing), to perfect that skill, to then transmit it to their colleagues, and ultimately to give back to society through their philanthropic and educational efforts.",How to Invest: Masters on the Craft,David M. Rubenstein
"Hard work and rigorous analysis can, though, provide some luck from time to time",How to Invest: Masters on the Craft,David M. Rubenstein
"My observation, though, is that the most detailed analysis, while helpful, does not always lead to the best investments.",How to Invest: Masters on the Craft,David M. Rubenstein
"Due diligence cannot always adequately predict future management mistakes or departures, economic recessions, new competition, technological developments, regulatory changes, or emerging social",How to Invest: Masters on the Craft,David M. Rubenstein
More venture deals fail than succeed—the opposite of buyout deals.,How to Invest: Masters on the Craft,David M. Rubenstein
"In a typical buyout, the investor is seeking a rate of return, after all expenses and fees, of about 15–20 percent per annum, with the average buyout being about a five-year investment.",How to Invest: Masters on the Craft,David M. Rubenstein
Do not risk more than you can truly afford to lose.,How to Invest: Masters on the Craft,David M. Rubenstein
So it is not necessary to be a world-class investor to have a world-class life.,How to Invest: Masters on the Craft,David M. Rubenstein
"You cannot read too much, or have too much knowledge about the world—and not just about the area of your investment focus.",How to Invest: Masters on the Craft,David M. Rubenstein
"Invariably, the path to success is eased with the guidance and support of mentors—individuals who are in your business or even outside it.",How to Invest: Masters on the Craft,David M. Rubenstein
"Investing can be a solitary business at times, but talented investors usually have had partners to fill gaps in their own areas of expertise and knowledge.",How to Invest: Masters on the Craft,David M. Rubenstein
"Failing to follow up, as promised, is one of the more common sins in the professional world,",How to Invest: Masters on the Craft,David M. Rubenstein
"Focus on developing a reputation for humility, cooperation, and ethical behavior.",How to Invest: Masters on the Craft,David M. Rubenstein
"But a reputation for being willing to listen to others, accept advice, not brag, and help others will go a long way toward building a successful and admirable career.",How to Invest: Masters on the Craft,David M. Rubenstein
"You will find a career in investing much more rewarding if you believe that this kind of activity is beneficial not only to you but also beneficial to your society, your economy, and your country.",How to Invest: Masters on the Craft,David M. Rubenstein
"investing only as a way to make more money than is possible in another profession, you will never have the intensity and drive and joy needed to be successful in this line of work.",How to Invest: Masters on the Craft,David M. Rubenstein
"(For many years, a common standard for investors was 60-40—60 percent in equities and 40 percent in fixed income.)",How to Invest: Masters on the Craft,David M. Rubenstein
"“If you focus on the needs of your clients, and if you can create something that is better than what the ecosystem provides, you have a huge opportunity to grow dramatically.”",How to Invest: Masters on the Craft,David M. Rubenstein
encyclopedic knowledge of where assets are moving around the world and what investors are doing with their money.,How to Invest: Masters on the Craft,David M. Rubenstein
"The objective was to build a firm to be proud of, to get rid of the politics of a big firm and focus on the needs of clients, and the results would be the results.",How to Invest: Masters on the Craft,David M. Rubenstein
"Wealth is an outcome of success, but there was not one person among us who was motivated principally by material possessions and achieving great wealth.",How to Invest: Masters on the Craft,David M. Rubenstein
It was about building something that we would be proud of.,How to Invest: Masters on the Craft,David M. Rubenstein
"Through securitization, we brought down that spread to about 150 basis points, or one and a half percent.",How to Invest: Masters on the Craft,David M. Rubenstein
securitization was a foundational reason why more Americans were able to buy homes.,How to Invest: Masters on the Craft,David M. Rubenstein
The result was that individuals with lower-quality credit would be able to get mortgages that previously would not have been available to them. These were typically called “subprime mortgages.” That led to the financial crisis.,How to Invest: Masters on the Craft,David M. Rubenstein
"In both cases, we did these acquisitions for growth and product, not for expense reduction.",How to Invest: Masters on the Craft,David M. Rubenstein
"asset management business, most of them are just consolidation plays. Our acquisitions were based on growth and building deeper relationships with our clients.",How to Invest: Masters on the Craft,David M. Rubenstein
financial services firms never consolidated onto one common platform.,How to Invest: Masters on the Craft,David M. Rubenstein
Many banks own 10 or 12 percent of deposits in any one state.,How to Invest: Masters on the Craft,David M. Rubenstein
"Some clients are looking for total return. Some clients are looking for tax-adjusted return. Some clients are looking for safe hands. Most importantly, clients are looking for somebody they can trust",How to Invest: Masters on the Craft,David M. Rubenstein
Our dialogue with our clients is all about how to shape a portfolio to meet their intermediate and long-term needs.,How to Invest: Masters on the Craft,David M. Rubenstein
"Institutional investors, we are all looking for relative performance versus liability. More and more, though, institutional",How to Invest: Masters on the Craft,David M. Rubenstein
"Institutional investors, we are all looking for relative performance versus liability.",How to Invest: Masters on the Craft,David M. Rubenstein
The individual investor is more focused on absolute returns on a risk-adjusted basis.,How to Invest: Masters on the Craft,David M. Rubenstein
We’ve lost the narrative of what’s important to all the men and women who are trying to build to live in retirement and dignity.,How to Invest: Masters on the Craft,David M. Rubenstein
"love markets, because they’re changing. I may not look it, but I feel young.",How to Invest: Masters on the Craft,David M. Rubenstein
"you’re going to be successful in finance and investing, and if you want to have a long career, you have to be a student your entire life. You have to be reeducating yourself every day about what’s going on in the ecosystem.",How to Invest: Masters on the Craft,David M. Rubenstein
"and investing, and if you want to have a long career, you have to be a student your entire life. You have to be reeducating yourself every day about what’s going on in the ecosystem.",How to Invest: Masters on the Craft,David M. Rubenstein
"ecosystem. I love markets, because they’re changing. I may not look it, but I feel young. I’m challenging myself every day. That’s why I said it’s not right for everybody. A lot of people don’t want to continue to grow, they want to just enjoy. But for those who love the challenge of change, for those who love that the global capital markets are the engine of economic activity globally, it’s a remarkable career. The joy comes from the desire of learning and reeducating and staying relevant and",How to Invest: Masters on the Craft,David M. Rubenstein
"If you’re going to be successful in finance and investing, and if you want to have a long career, you have to be a student your entire life.",How to Invest: Masters on the Craft,David M. Rubenstein
"I love markets, because they’re changing. I may not look it, but I feel young.",How to Invest: Masters on the Craft,David M. Rubenstein
"A lot of people don’t want to continue to grow, they want to just enjoy.",How to Invest: Masters on the Craft,David M. Rubenstein
"If you are going to have a bright career in finance and investing, you are going to have to challenge yourself every day and grow and learn. The moment you stop growing and learning, someone’s passing you by.”",How to Invest: Masters on the Craft,David M. Rubenstein
"Because if you buy and sell, you pay taxes every time you do that, number one. Number two, what makes me think I’m so smart that I’m going to be able to figure out the exact top and the exact bottom, buy here, sell there?",How to Invest: Masters on the Craft,David M. Rubenstein
"RB:I want someone who’s really smart, works really hard, has integrity.",How to Invest: Masters on the Craft,David M. Rubenstein
"In general, I give up because we made a mistake on the business or the person, not because a stock doesn’t perform.",How to Invest: Masters on the Craft,David M. Rubenstein
"So at its heart, it’s competitively advantaged, has great people, and there’s big growth opportunities.",How to Invest: Masters on the Craft,David M. Rubenstein
The stock price reflects what people think about it at that point in time. It doesn’t reflect what the value of that business is at that point in time.,How to Invest: Masters on the Craft,David M. Rubenstein
Most people want to have their money grow consistently every day and make high returns and low fees without volatility.,How to Invest: Masters on the Craft,David M. Rubenstein
"I love what I do. When I get to meet and talk with people who run businesses and who are changing the world and explain to me how they’re doing it, it is so much fun.",How to Invest: Masters on the Craft,David M. Rubenstein
"My job is different. I’m trying to build an institution that’s going to last for a hundred years. DR: If somebody wants to invest with you, how much do they have to invest to be in one of your funds?",How to Invest: Masters on the Craft,David M. Rubenstein
"“Okay, I’m going to do that.” Their job was to make enough money so they could retire and live comfortably. My job is different. I’m trying to build an institution that’s going to last for a hundred years.",How to Invest: Masters on the Craft,David M. Rubenstein
"When the market falls, for example, like right now, there’s been a rotation out of the kind of companies we’ve invested in that have done so well for the past couple of years into cheaper “value” stocks.",How to Invest: Masters on the Craft,David M. Rubenstein
"secrets—most citizens will not want to break the law. I’m not saying it will, but I think there’s some risk it could.",How to Invest: Masters on the Craft,David M. Rubenstein
“Would your younger self be proud of you for what you’ve accomplished in your life? Would your younger self be proud of you for what you’ve done?” That’s a good guidepost.,How to Invest: Masters on the Craft,David M. Rubenstein
should study the businesses in which they’re investing or in which they want to invest and why they’re going to invest in them;,How to Invest: Masters on the Craft,David M. Rubenstein
"if the well-being of their families was dependent upon their being right on the business in which we’re investing on their recommendation, what would they need to know to be able to make that recommendation?",How to Invest: Masters on the Craft,David M. Rubenstein
How does something work? What’s good or bad about it? And what makes what you’re doing different than anyone else?,How to Invest: Masters on the Craft,David M. Rubenstein
“Don’t worry about earnings per share. They make up those numbers. Worry about sales.”,How to Invest: Masters on the Craft,David M. Rubenstein
"It has achieved that status by relentlessly pursuing its “value” investment approach, and not chasing the latest fad in investing or pursuing expensive (“nonvalue”) investments.",How to Invest: Masters on the Craft,David M. Rubenstein
"I thought we had an original approach to small- and mid-cap value investing,",How to Invest: Masters on the Craft,David M. Rubenstein
"the best way to be a successful investor was to be a contrarian, to not follow the crowd.",How to Invest: Masters on the Craft,David M. Rubenstein
madness of crowds can take over markets and force inefficiencies into some very efficient markets.,How to Invest: Masters on the Craft,David M. Rubenstein
Being greedy when others are fearful was one of his key themes.,How to Invest: Masters on the Craft,David M. Rubenstein
“You want to buy when there’s maximum pessimism.”,How to Invest: Masters on the Craft,David M. Rubenstein
stocks that were selling at low prices relative to their earnings and their cash flow.,How to Invest: Masters on the Craft,David M. Rubenstein
"It’s this ability to execute value investing in what we call “crunch times,”",How to Invest: Masters on the Craft,David M. Rubenstein
You have to have the courage to go in there and buy when everyone’s sitting on their hands or selling.,How to Invest: Masters on the Craft,David M. Rubenstein
"They saw my passion for the markets, how much I loved it, how much I loved reading about it, how I was developing an approach to investing.",How to Invest: Masters on the Craft,David M. Rubenstein
"The core values are still there of buying wonderful companies that are undervalued, that have great management teams, strong balance sheets.",How to Invest: Masters on the Craft,David M. Rubenstein
"You have to be willing to hear all different sides, make sure you’re talking to competitors, to suppliers, to other money managers who don’t like that industry, to push yourself to have nonconfirming information to help you make decisions.",How to Invest: Masters on the Craft,David M. Rubenstein
The second lesson is that the ability to stand alone and not feel pressure to be like everyone else is critical.,How to Invest: Masters on the Craft,David M. Rubenstein
"When you buy a stock, how long do you typically hold on to it? JR: It’s typically five years,",How to Invest: Masters on the Craft,David M. Rubenstein
I can’t wait to turn on CNBC and see how the market’s opening up. I get the early indications from my deputy portfolio manager of what’s moving the markets.,How to Invest: Masters on the Craft,David M. Rubenstein
"It’s like being a treasure hunter out there looking for buried treasure, looking for wonderful companies that have been misunderstood and misplaced",How to Invest: Masters on the Craft,David M. Rubenstein
the best way to get exposed to the markets is to work in the investment offices of the university that they happen to be a part of.,How to Invest: Masters on the Craft,David M. Rubenstein
"I start out with the five newspapers [the New York Times, Wall Street Journal, Financial Times, Chicago Tribune, and Chicago Sun-Times].",How to Invest: Masters on the Craft,David M. Rubenstein
"too—build relationships with your peers in business school so that you can talk to them 30 years, 40 years later, when you need independent advice on a tough decision you’re making in the markets or out of the markets.",How to Invest: Masters on the Craft,David M. Rubenstein
"core real estate, core-plus, value-added, and opportunistic. What are those four different categories?",How to Invest: Masters on the Craft,David M. Rubenstein
"You’re trying to produce 20 percent gross, 15 percent net to the customer.",How to Invest: Masters on the Craft,David M. Rubenstein
"I would say residential real estate is safer, less volatile. Commercial real estate involves office buildings;",How to Invest: Masters on the Craft,David M. Rubenstein
"If you have the skill set, you can evaluate, plus you travel a lot.",How to Invest: Masters on the Craft,David M. Rubenstein
"I love the people. I love learning about all these different places. I got to see all of the United States, virtually all of the developed world.",How to Invest: Masters on the Craft,David M. Rubenstein
"The warning signs for real estate are twofold. One is too much leverage, too much capital.",How to Invest: Masters on the Craft,David M. Rubenstein
"The other is too many cranes, too much building. We’re actually below historic levels, in terms of new supply.",How to Invest: Masters on the Craft,David M. Rubenstein
One positive thing about real estate is that inflation drives up the replacement cost of buildings.,How to Invest: Masters on the Craft,David M. Rubenstein
"When we think about our company, we know we’re better together: we’re better at being creative, we’re better at solving problems, we’re better at training our young people. It’s an apprenticeship business, learning how to invest.",How to Invest: Masters on the Craft,David M. Rubenstein
"Tech is driving so much of the growth in this global economy, those are the most interesting places to invest.",How to Invest: Masters on the Craft,David M. Rubenstein
doubt there is any other area of commerce where more leverage (or debt) is available than in real estate.,How to Invest: Masters on the Craft,David M. Rubenstein
The most successful people who have worked for me have had the highest degree of motivation.,How to Invest: Masters on the Craft,David M. Rubenstein
