quote,book title,author
"The feminine’s moods and opinions are like weather patterns. They are constantly changing, severe and gentle, and they have no single source.",The Way of the Superior Man,David Deida
"And so, when your woman seems to have an emotional problem, you want to know why.",The Way of the Superior Man,David Deida
"You are under the illusion that when you find out the cause of her affliction, then the cure will easily follow.",The Way of the Superior Man,David Deida
The amazing thing is this: 90 percent of a woman’s emotional problems stem from feeling unloved.,The Way of the Superior Man,David Deida
Give her your love—the same love that is motivating your questioning—immediately and unmistakably.,The Way of the Superior Man,David Deida
It’s so easy to give her love; it’s what both of you really want anyway. But as a man you are more likely to try to fix her.,The Way of the Superior Man,David Deida
"The next time your woman is in a bad mood, try this: Assume she is not feeling loved.",The Way of the Superior Man,David Deida
"Then, after her mood has been dissolved by your loving and she is happy and relaxed, you can talk about anything that still needs to be talked about.",The Way of the Superior Man,David Deida
One of the deepest feminine desires in intimacy is precisely not to have to always figure it out for her man and guide him.,The Way of the Superior Man,David Deida
"One of the deepest feminine desires in intimacy (though not in business or simple friendship) is to be able to relax and surrender, knowing that her man is taking care of everything.",The Way of the Superior Man,David Deida
Women do not become free by analyzing themselves. They become free by surrendering into love.,The Way of the Superior Man,David Deida
"The best way you can serve your woman is by helping her to surrender, to trust the force of love, so that she can open her heart, be the love that she is, and give this love which naturally overflows from her happiness.",The Way of the Superior Man,David Deida
"One of the deepest feminine pleasures is when a man stands full, present, and unreactive in the midst of his woman’s emotional storms.",The Way of the Superior Man,David Deida
"If that polarity begins to diminish, conflicts will begin to increase. When that polarity disappears, attraction disappears, and the life of the intimacy disappears with it.",The Way of the Superior Man,David Deida
"“I’d like the red shoes, but what’s the most important to me is that you’re happy.”",The Way of the Superior Man,David Deida
"And, more importantly for the intimacy, if you don’t contribute to her masculine decision making process, the two of you will become depolarized by each other’s energy.",The Way of the Superior Man,David Deida
"Then, you will find that she trusts you less and less across the board. She will refuse to surrender to you even sexually, because she hasn’t been able to relax and trust you all day;",The Way of the Superior Man,David Deida
"As a practice, always help your woman make decisions by giving her your perspective and telling her your choices, while letting her know that you love her regardless of the decision she makes.",The Way of the Superior Man,David Deida
"always tell her what you would do and why, even if you think she should make her own decision.",The Way of the Superior Man,David Deida
Masculine men are attracted to feminine women. Feminine men are attracted to masculine women.,The Way of the Superior Man,David Deida
Your confession of desire is a confession of your desire to embrace life.,The Way of the Superior Man,David Deida
"So, choose a woman who is your complementary opposite, which for most men means a more feminine woman.",The Way of the Superior Man,David Deida
"what is the purpose of your intimacy, and align all other activities around this central priority, if you want your intimacy to maintain and increase its potency for both of you.",The Way of the Superior Man,David Deida
The fact is you probably want to have sex with other women besides your intimate partner; how you respond to this fact is a reflection of your purpose in life.,The Way of the Superior Man,David Deida
"It’s important that, in the meantime, you don’t mistake a changing energy need for a reason to end your marriage.",The Way of the Superior Man,David Deida
"If a man wants a woman who doesn’t want him, he cannot win. His neediness will undermine any possible relationship, and his woman will never be able to trust him.",The Way of the Superior Man,David Deida
"If she doesn’t want him, he should immediately cease pursuing her and deal with his pain by himself.",The Way of the Superior Man,David Deida
"If you ever find yourself in a situation where you want to be with a woman but she doesn’t want to be with you, you must speak with your friends.",The Way of the Superior Man,David Deida
You are only punishing yourself when you want to be in a relationship with a woman more than she wants to be a in a relationship with you.,The Way of the Superior Man,David Deida
She won’t be disappointed if she feels you are strong and clear in the true direction of your heart. And,The Way of the Superior Man,David Deida
"The thing your woman is complaining about is rarely the thing she is complaining about. It is a mistake to believe the content of what she is saying, and then respond to her complaints, point by point.",The Way of the Superior Man,David Deida
"A woman sometimes seems to want to be the most important thing in her man’s life. However, if she is the most important thing, then she feels her man has made her the number one priority and is not fully dedicated or directed to divine growth and service.",The Way of the Superior Man,David Deida
"If a woman has become the point of your life, you are lost.",The Way of the Superior Man,David Deida
"You have a gift to give, a purpose to fulfill, a deep heart-impulse that moves you.",The Way of the Superior Man,David Deida
There is no use trying to mitigate her anger by referring to your great track record.,The Way of the Superior Man,David Deida
"If you want your woman to be able to relax into her feminine and shine her natural radiance, then you must relieve her of the necessity to be in charge.",The Way of the Superior Man,David Deida
Facing the potential burglar at night is only a sign to your woman that you are willing to lose everything into love.,The Way of the Superior Man,David Deida
"you collapse or react with unlove when she questions your financial ability, she will continue to do so. If you feel weakened when she questions your sexual ability, she will continue to do so, implicitly or explicitly.",The Way of the Superior Man,David Deida
"There is never a shortage of women or feminine energy. If a man feels that there aren’t enough women, or that life isn’t giving him what he wants, he is simply negating his relationship to the feminine.",The Way of the Superior Man,David Deida
"Do the same in the company of human women. Feel them not merely as friends, coworkers, or sisters, but as walking blessings of energy.",The Way of the Superior Man,David Deida
The natural sexiness of a young woman will always give you energy. You never need to deny this.,The Way of the Superior Man,David Deida
"When you feel sexual lust or desire for any woman, breathe deeply and allow the feeling of desire to magnify. And allow it to magnify more.",The Way of the Superior Man,David Deida
"Don’t let the energy become lodged in your head or genitals, but circulate it throughout your body.",The Way of the Superior Man,David Deida
"It is not time that kills delight, but familiarity, neutralization, and lack of purpose.",The Way of the Superior Man,David Deida
Your need is far deeper than any woman can provide.,The Way of the Superior Man,David Deida
"Then, you will discover that ejaculation, for the most part, actually depletes and weakens you.",The Way of the Superior Man,David Deida
"In a subtle way, excess ejaculations will diminish your courage to take risks, professionally and spiritually.",The Way of the Superior Man,David Deida
"always, her deepest pleasure is in feeling your fullness, your strength, and your love, even while she is testing you.",The Way of the Superior Man,David Deida
"Whenever you notice that you are mulling over your own problems, knotting energy into your body as tension, take that energy and create a gift for others. It could be as simple as doing the dishes in the sink, or as complex as building a business that will benefit others.",The Way of the Superior Man,David Deida
"The desire for intimate loving is as central to your woman’s life as the mission toward freedom—financial,",The Way of the Superior Man,David Deida
"The desire for intimate loving is as central to your woman’s life as the mission toward freedom—financial, psychological, and spiritual—is to yours.",The Way of the Superior Man,David Deida
Only by staying intimate with your personal suffering can you feel through it to its source.,The Way of the Superior Man,David Deida
"You must instill consequences throughout the rest of your life, unless you want to cling to the safety net of superficial pleasures.",The Way of the Superior Man,David Deida
"Just as your woman must regularly spend time with only women, you must regularly spend time with only men.",Die With Zero,"Perkins, Bill"
Maximizing your fulfillment from experiences—by planning how you will spend your time and money to achieve the biggest peaks you can with the resources you have—is how you maximize,Attached: The New Science of Adult Attachment and How It Can Help You Find and Keep Love .epub,Amir Levine
Greg feared getting too close and was uncomfortable with commitment.,Attached: The New Science of Adult Attachment and How It Can Help You Find and Keep Love .epub,Amir Levine
adults show patterns of attachment to their romantic partners similar to the patterns of attachment of children with their parents.,Attached: The New Science of Adult Attachment and How It Can Help You Find and Keep Love .epub,Amir Levine
"Attachment theory designates three main “attachment styles,”",Attached: The New Science of Adult Attachment and How It Can Help You Find and Keep Love .epub,Amir Levine
"one of the main messages of this theory is that in romantic situations, we are programmed to act in a predetermined manner.",Attached: The New Science of Adult Attachment and How It Can Help You Find and Keep Love .epub,Amir Levine
it was hypothesized that your current attachment style is determined by the way in which you were cared for as a baby:,Attached: The New Science of Adult Attachment and How It Can Help You Find and Keep Love .epub,Amir Levine
"we know that attachment styles in adulthood are influenced by a variety of factors, one of which is the way our parents cared for us, but other factors also come into play, including our genes and life experiences.",Attached: The New Science of Adult Attachment and How It Can Help You Find and Keep Love .epub,Amir Levine
"Intriguingly, the research findings explained that though he wanted to be close to her, he felt compel ed to push her away—not",Attached: The New Science of Adult Attachment and How It Can Help You Find and Keep Love .epub,Amir Levine
"Although it’s not impossible for someone to change his or her attachment style—on average,",Attached: The New Science of Adult Attachment and How It Can Help You Find and Keep Love .epub,Amir Levine
those who were with somebody who deeply cared about them survived to pass on to their offspring the preference to form intimate bonds.,Attached: The New Science of Adult Attachment and How It Can Help You Find and Keep Love .epub,Amir Levine
"Although we al have a basic need to form close bonds, the way we create them varies.",Attached: The New Science of Adult Attachment and How It Can Help You Find and Keep Love .epub,Amir Levine
People with a secure attachment style know how to communicate their own expectations and respond to their partner’s needs effectively without having to resort to protest behavior.,Attached: The New Science of Adult Attachment and How It Can Help You Find and Keep Love .epub,Amir Levine
"people vary greatly in their need for intimacy and closeness,",Attached: The New Science of Adult Attachment and How It Can Help You Find and Keep Love .epub,Amir Levine
"Applied Adult Attachment, a methodology that is relevant for a variety of relationship situations.",Attached: The New Science of Adult Attachment and How It Can Help You Find and Keep Love .epub,Amir Levine
Getting attached means that our brain becomes wired to seek the support of our partner by ensuring their psychological and physical proximity.,Attached: The New Science of Adult Attachment and How It Can Help You Find and Keep Love .epub,Amir Levine
Attachment principles teach us that most people are only as needy as their unmet needs.,Attached: The New Science of Adult Attachment and How It Can Help You Find and Keep Love .epub,Amir Levine
"If our partner fails to reassure us, we are programmed to continue our attempts to achieve closeness until they do.",Attached: The New Science of Adult Attachment and How It Can Help You Find and Keep Love .epub,Amir Levine
"“dependency paradox”: The more effectively dependent people are on one another, the more independent and daring they become.",Attached: The New Science of Adult Attachment and How It Can Help You Find and Keep Love .epub,Amir Levine
"Bowlby, however, observed that even infants who had al of their nutritional needs taken care of but lacked an attachment figure (such as infants raised in institutions or displaced during the Second World War) failed to develop normal y.",Attached: The New Science of Adult Attachment and How It Can Help You Find and Keep Love .epub,Amir Levine
Attached: The New Science of Adult Attachment and How It Can Help You Find and Keep Love .epub (Amir Levine),Attached: The New Science of Adult Attachment and How It Can Help You Find and Keep Love .epub,Amir Levine
"Among adults, the prevailing notion is stil that too much dependence in a relationship is a bad thing.",Attached: The New Science of Adult Attachment and How It Can Help You Find and Keep Love .epub,Amir Levine
Your happiness is something that should come from within and should not be dependent on your lover or mate.,Attached: The New Science of Adult Attachment and How It Can Help You Find and Keep Love .epub,Amir Levine
"The basic premise underlying this point of view is that the ideal relationship is one between two self-sufficient people who unite in a mature, respectful way while maintaining clear boundaries.",Attached: The New Science of Adult Attachment and How It Can Help You Find and Keep Love .epub,Amir Levine
"Numerous studies show that once we become attached to someone, the two of us form one physiological unit.",Attached: The New Science of Adult Attachment and How It Can Help You Find and Keep Love .epub,Amir Levine
Dependency is a fact; it is not a choice or a preference.,Attached: The New Science of Adult Attachment and How It Can Help You Find and Keep Love .epub,Amir Levine
"The study demonstrates that when two people form an intimate relationship, they regulate each other’s psychological and emotional wel -being.",Attached: The New Science of Adult Attachment and How It Can Help You Find and Keep Love .epub,Amir Levine
"He discovered that once we choose someone special, powerful and often uncontrol able forces come into play. New patterns of behavior kick in regardless of how independent we are and despite our conscious wil",Attached: The New Science of Adult Attachment and How It Can Help You Find and Keep Love .epub,Amir Levine
"If you want to take the road to independence and happiness, first find the right person to depend on and travel down it with them.",Attached: The New Science of Adult Attachment and How It Can Help You Find and Keep Love .epub,Amir Levine
having an attachment figure in the room was enough to al ow a child to go out into a previously unknown environment and explore with confidence.,Attached: The New Science of Adult Attachment and How It Can Help You Find and Keep Love .epub,Amir Levine
Having a partner who fulfil s our intrinsic attachment needs and feels comfortable acting as a secure base and safe haven can help us remain emotional y and physical y healthier and live longer.,Attached: The New Science of Adult Attachment and How It Can Help You Find and Keep Love .epub,Amir Levine
"Having a partner who is inconsistently available or supportive can be a truly demoralizing and debilitating experience that can literal y stunt our growth and stymie our health. The rest of the book is about how to go about finding a partner who can become your secure base, becoming that kind of partner yourself, and helping your existing partner take on this life-altering role. USING THIS BOOK How can this book guide you in looking for love in al the right places and improving your existing relationships? After the introduction, we invite you to “rol up your sleeves” and get straight to business by determining your own attachment style. This wil al ow you to home in on your unique relationship “DNA” or attachment style. Next you’l learn how to identify the attachment styles of those around you. These are key chapters, the first steps in understanding your specific needs in relationships and who wil be able (or unable) to meet those needs. We’l guide you through this process step-by-step and then give you a chance to practice your new skil s. The next part discusses each attachment style in more detail. You’l start to get a better feel for the inner workings of each style. You may experience these chapters as a true revelation as they al ow you to see your own romantic experiences and the experiences of people around you in a fresh new light. Part three comes with a big warning sign attached. You’l learn the emotional price of connecting with someone who has drastical y different intimacy needs from your own. We describe the specific problems of the anxiousavoidant trap and advise you on the cost of remaining in such a relationship. If you are already in such a bond and want to make it work, this part wil guide you through the process. By uncovering the specific needs and vulnerabilities of each attachment style (your own and your partner’s), and fol owing tips and specific interventions that are tailored to the anxiousavoidant connection, you wil be able to bring the relationship to a more secure place. Should",Attached: The New Science of Adult Attachment and How It Can Help You Find and Keep Love .epub,Amir Levine
Having a partner who is inconsistently available or supportive can be a truly demoralizing and debilitating experience that can literal y stunt our growth and stymie our health.,Attached: The New Science of Adult Attachment and How It Can Help You Find and Keep Love .epub,Amir Levine
"In dating situations, your thinking wil shift from “Does he or she like me?” to “Is this someone I should invest in emotional y?",Attached: The New Science of Adult Attachment and How It Can Help You Find and Keep Love .epub,Amir Levine
"Keep in mind that when you’re excited about someone, your objectivity is compromised and you tend to create a rosy picture of him or her.",Attached: The New Science of Adult Attachment and How It Can Help You Find and Keep Love .epub,Amir Levine
Uncovering your partner’s attachment style wil al ow you to better understand the particular chal enges that you face as a couple—an,Attached: The New Science of Adult Attachment and How It Can Help You Find and Keep Love .epub,Amir Levine
"Don’t be afraid to express your needs, thoughts, and feelings to your partner!",Attached: The New Science of Adult Attachment and How It Can Help You Find and Keep Love .epub,Amir Levine
"However, expressing your needs and true feelings can be a useful litmus test of the other person’s capacity to meet your needs.",Attached: The New Science of Adult Attachment and How It Can Help You Find and Keep Love .epub,Amir Levine
“Al happiness or unhappiness solely depends upon the quality of the object to which we are attached by love.”,Attached: The New Science of Adult Attachment and How It Can Help You Find and Keep Love .epub,Amir Levine
"If you have an anxious attachment style, you possess a unique ability to sense when your relationship is threatened.",Attached: The New Science of Adult Attachment and How It Can Help You Find and Keep Love .epub,Amir Levine
These findings suggest that people with an anxious attachment style are indeed more vigilant to changes in others’ emotional expression,Attached: The New Science of Adult Attachment and How It Can Help You Find and Keep Love .epub,Amir Levine
"people with an anxious attachment style tend to jump to conclusions very quickly, and when they do, they tend to misinterpret people’s emotional state.",Attached: The New Science of Adult Attachment and How It Can Help You Find and Keep Love .epub,Amir Levine
"If you just wait a little longer before reacting and jumping to conclusions, you wil have an uncanny ability to decipher the world around you and use it to your advantage.",Attached: The New Science of Adult Attachment and How It Can Help You Find and Keep Love .epub,Amir Levine
"Notice that if you feel unsettled in a relationship situation, al that is required is a minimal reassurance from your partner—one",Attached: The New Science of Adult Attachment and How It Can Help You Find and Keep Love .epub,Amir Levine
"worries about the relationship wil quadruple, and it wil take a lot more than a simple text to calm your attachment system.",Attached: The New Science of Adult Attachment and How It Can Help You Find and Keep Love .epub,Amir Levine
"While Emily was with David, in terms of relationships, she lived her life in the danger zone.",Attached: The New Science of Adult Attachment and How It Can Help You Find and Keep Love .epub,Amir Levine
"While Emily was with David, in terms of relationships, she lived her life in the danger zone.",Attached: The New Science of Adult Attachment and How It Can Help You Find and Keep Love .epub,Amir Levine
"While Emily was with David, in terms of relationships, she lived her life in the danger zone.",Attached: The New Science of Adult Attachment and How It Can Help You Find and Keep Love .epub,Amir Levine
This is part of what heartache is al about— the longing for someone who is no longer available to us when our biological and emotional makeup is programmed to try to win them back.,Attached: The New Science of Adult Attachment and How It Can Help You Find and Keep Love .epub,Amir Levine
"in order to thrive and grow as human beings, we need a secure base from which to derive strength and comfort.",Attached: The New Science of Adult Attachment and How It Can Help You Find and Keep Love .epub,Amir Levine
"date someone and find yourself feeling anxious, insecure, and obsessive—only to feel elated every once in a while— tel yourself this is most likely an activated attachment system and not love!",Attached: The New Science of Adult Attachment and How It Can Help You Find and Keep Love .epub,Amir Levine
"If You’re Anxious, You Shouldn’t Be Dating Someone Avoidant Because:",Attached: The New Science of Adult Attachment and How It Can Help You Find and Keep Love .epub,Amir Levine
People with a secure attachment style usual y don’t go through many partners before they find one that they happily settle down with.,Attached: The New Science of Adult Attachment and How It Can Help You Find and Keep Love .epub,Amir Levine
You associate a calm attachment system with boredom and indifference. Because of this fal acy you might let the perfect partner pass you by.,Attached: The New Science of Adult Attachment and How It Can Help You Find and Keep Love .epub,Amir Levine
"you are used to equating an activated attachment system with love,",Attached: The New Science of Adult Attachment and How It Can Help You Find and Keep Love .epub,Amir Levine
"Another problem is that if this type of game playing is only an act for you, it’s going to backfire in the long",Attached: The New Science of Adult Attachment and How It Can Help You Find and Keep Love .epub,Amir Levine
"After al , what you real y want is to reach a high degree of intimacy, to spend a lot of quality time together, to be able to let down your guard.",Attached: The New Science of Adult Attachment and How It Can Help You Find and Keep Love .epub,Amir Levine
"The key to finding a mate who can fulfil those needs is to first ful y acknowledge your need for intimacy, availability, and security",Attached: The New Science of Adult Attachment and How It Can Help You Find and Keep Love .epub,Amir Levine
"Next, use this knowledge. Start assessing people you date on the basis of their ability to meet those needs.",Attached: The New Science of Adult Attachment and How It Can Help You Find and Keep Love .epub,Amir Levine
“I love you very much; I need to know that you are there for me al the time. I want to know I can talk to you every day and not just when it’s convenient for you. I don’t want to have to cover up my wish to spend time with you for fear of driving you away.” But,Attached: The New Science of Adult Attachment and How It Can Help You Find and Keep Love .epub,Amir Levine
before you really get to know him/her and decide whether you like that person or not!,Attached: The New Science of Adult Attachment and How It Can Help You Find and Keep Love .epub,Amir Levine
