quote,book title,author
"analyst recommendations are tainted by the very profitable investment banking relationships of the brokerage firms. Several studies have assessed the accuracy of analysts’ stock selections. Brad Barber of the University of California studied the performance of the “strong buy” recommendations of Wall Street analysts and found it nothing short of “disastrous.” Indeed, the analysts’ strong buy recommendations underperformed the market as a whole by 3 percent per month, while their sell recommendations outperformed the markets by 3.8 percent per month. Even worse, researchers at Dartmouth and Cornell found that stock recommendations of Wall Street firms without",A Random Walk Down Wall Street: The Time-Tested Strategy for Successful Investing (Eleventh Edition),Burton G. Malkiel
analyst recommendations are tainted by the very profitable investment banking relationships of the brokerage firms.,A Random Walk Down Wall Street: The Time-Tested Strategy for Successful Investing (Eleventh Edition),Burton G. Malkiel
A study from Investors.com found that investors lost over 50 percent when they followed the advice of an analyst employed by a Wall Street firm that managed or co-managed the initial public offering of the recommended stock.,A Random Walk Down Wall Street: The Time-Tested Strategy for Successful Investing (Eleventh Edition),Burton G. Malkiel
"risk alone, determines the degree to which returns will be above or below average.",A Random Walk Down Wall Street: The Time-Tested Strategy for Successful Investing (Eleventh Edition),Burton G. Malkiel
financial risk has generally been defined as the variance or standard deviation of returns.,A Random Walk Down Wall Street: The Time-Tested Strategy for Successful Investing (Eleventh Edition),Burton G. Malkiel
anything less than perfect positive correlation can potentially reduce risk.,A Random Walk Down Wall Street: The Time-Tested Strategy for Successful Investing (Eleventh Edition),Burton G. Malkiel
theory—can reap even greater protection because the movement of foreign economies is not always synchronous with that of the U.S.,A Random Walk Down Wall Street: The Time-Tested Strategy for Successful Investing (Eleventh Edition),Burton G. Malkiel
overall portfolio risk is reduced by the addition of a small amount of riskier foreign securities.,A Random Walk Down Wall Street: The Time-Tested Strategy for Successful Investing (Eleventh Edition),Burton G. Malkiel
Investors who limited their portfolios to stocks in developed economies failed to earn satisfactory returns.,A Random Walk Down Wall Street: The Time-Tested Strategy for Successful Investing (Eleventh Edition),Burton G. Malkiel
there is no premium for bearing risks that can be diversified away.,A Random Walk Down Wall Street: The Time-Tested Strategy for Successful Investing (Eleventh Edition),Burton G. Malkiel
The beta calculation is essentially a comparison between the movements of an individual stock (or portfolio) and the movements of the market as a whole.,A Random Walk Down Wall Street: The Time-Tested Strategy for Successful Investing (Eleventh Edition),Burton G. Malkiel
"The only part of total risk that investors will get paid for bearing is systematic risk, the risk that diversification cannot help.",A Random Walk Down Wall Street: The Time-Tested Strategy for Successful Investing (Eleventh Edition),Burton G. Malkiel
"Thus, the capital-asset pricing model says that returns (and, therefore, risk premiums) for any stock (or portfolio) will be related to beta, the systematic risk that cannot be diversified away.",A Random Walk Down Wall Street: The Time-Tested Strategy for Successful Investing (Eleventh Edition),Burton G. Malkiel
diversified portfolios made up of stocks with large amounts of unsystematic risk would give larger returns than equally risky portfolios of stocks with less unsystematic risk.,A Random Walk Down Wall Street: The Time-Tested Strategy for Successful Investing (Eleventh Edition),Burton G. Malkiel
"The CAPM then asserts that to get a higher average long-run rate of return, you should just increase the beta of your portfolio.",A Random Walk Down Wall Street: The Time-Tested Strategy for Successful Investing (Eleventh Edition),Burton G. Malkiel
This last is the fancy word used to describe people who profit from any deviation of market prices from their rational value.,A Random Walk Down Wall Street: The Time-Tested Strategy for Successful Investing (Eleventh Edition),Burton G. Malkiel
"They found that the more individual investors traded, the worse they did.",A Random Walk Down Wall Street: The Time-Tested Strategy for Successful Investing (Eleventh Edition),Burton G. Malkiel
People are prone to attribute any good outcome to their own abilities. They tend to rationalize bad outcomes as resulting from unusual external events.,A Random Walk Down Wall Street: The Time-Tested Strategy for Successful Investing (Eleventh Edition),Burton G. Malkiel
players were willing to sell their cards were systematically higher for those who chose their cards than for the group who had simply been given a card.,A Random Walk Down Wall Street: The Time-Tested Strategy for Successful Investing (Eleventh Edition),Burton G. Malkiel
the probability that somebody belongs to both category A and category B is less than or equal to the probability that she belongs to category A alone.,A Random Walk Down Wall Street: The Time-Tested Strategy for Successful Investing (Eleventh Edition),Burton G. Malkiel
"experiment, subjects have been shown to underuse the knowledge of base rates when making predictions.",A Random Walk Down Wall Street: The Time-Tested Strategy for Successful Investing (Eleventh Edition),Burton G. Malkiel
"As communist economies have discovered to their dismay, an all-powerful central planner cannot possibly achieve any semblance of market efficiency in deciding what goods to produce and how resources should be allocated.",A Random Walk Down Wall Street: The Time-Tested Strategy for Successful Investing (Eleventh Edition),Burton G. Malkiel
people said actually changed what subjects believed they saw.,A Random Walk Down Wall Street: The Time-Tested Strategy for Successful Investing (Eleventh Edition),Burton G. Malkiel
Mutual-fund managers have a tendency to follow the same strategies and herd into the same stocks.,A Random Walk Down Wall Street: The Time-Tested Strategy for Successful Investing (Eleventh Edition),Burton G. Malkiel
One of the most important lessons of behavioral finance is that individual investors must avoid being carried away by herd behavior.,A Random Walk Down Wall Street: The Time-Tested Strategy for Successful Investing (Eleventh Edition),Burton G. Malkiel
"When doctors are faced with decisions regarding treatment options for people with cancer, different choices tend to be made if the problem is stated in terms of survival probabilities rather than mortality probabilities.",A Random Walk Down Wall Street: The Time-Tested Strategy for Successful Investing (Eleventh Edition),Burton G. Malkiel
This reluctance to take losses is clearly non-optimal according to rational investment theory,A Random Walk Down Wall Street: The Time-Tested Strategy for Successful Investing (Eleventh Edition),Burton G. Malkiel
"you are contemplating making a stock trade (and you are married), ask your wife whether you should do it.",A Random Walk Down Wall Street: The Time-Tested Strategy for Successful Investing (Eleventh Edition),Burton G. Malkiel
men tended to be more overconfident and trade far more frequently than women.,A Random Walk Down Wall Street: The Time-Tested Strategy for Successful Investing (Eleventh Edition),Burton G. Malkiel
"If growth does materialize, both the earnings and the earnings multiple will likely increase, giving the investor a double benefit. Buying a high-multiple stock whose earnings growth fails to materialize subjects investors to a double whammy.",A Random Walk Down Wall Street: The Time-Tested Strategy for Successful Investing (Eleventh Edition),Burton G. Malkiel
Stocks that sell at low ratios of price to book value tend to produce higher future returns.,A Random Walk Down Wall Street: The Time-Tested Strategy for Successful Investing (Eleventh Edition),Burton G. Malkiel
stock returns is the tendency over long periods of time for small-company stocks to generate larger returns than those of large-company stocks.,A Random Walk Down Wall Street: The Time-Tested Strategy for Successful Investing (Eleventh Edition),Burton G. Malkiel
there was very strong statistical evidence of return reversals.,A Random Walk Down Wall Street: The Time-Tested Strategy for Successful Investing (Eleventh Edition),Burton G. Malkiel
High-beta portfolios do not produce higher returns than low-beta ones.,A Random Walk Down Wall Street: The Time-Tested Strategy for Successful Investing (Eleventh Edition),Burton G. Malkiel
"There is considerable evidence of “reversion to the mean,” and periods of excess performance are often followed by periods of disappointing results.",A Random Walk Down Wall Street: The Time-Tested Strategy for Successful Investing (Eleventh Edition),Burton G. Malkiel
The single most important thing you can do to achieve financial security is to begin a regular savings program and to start it as early as possible.,A Random Walk Down Wall Street: The Time-Tested Strategy for Successful Investing (Eleventh Edition),Burton G. Malkiel
"To get rich, you will have to do it slowly, and you have to start now.",A Random Walk Down Wall Street: The Time-Tested Strategy for Successful Investing (Eleventh Edition),Burton G. Malkiel
Start saving early and save regularly. Live modestly and don’t touch the money that’s been set aside.,A Random Walk Down Wall Street: The Time-Tested Strategy for Successful Investing (Eleventh Edition),Burton G. Malkiel
"For individuals, home and auto insurance are a must. So is health and disability insurance.",A Random Walk Down Wall Street: The Time-Tested Strategy for Successful Investing (Eleventh Edition),Burton G. Malkiel
My advice is to buy renewable term insurance; you can keep renewing your policy without the need for a physical examination.,A Random Walk Down Wall Street: The Time-Tested Strategy for Successful Investing (Eleventh Edition),Burton G. Malkiel
You do not need an insurance agent.,A Random Walk Down Wall Street: The Time-Tested Strategy for Successful Investing (Eleventh Edition),Burton G. Malkiel
Money-market mutual funds often provide investors the best instrument for parking their cash reserves.,A Random Walk Down Wall Street: The Time-Tested Strategy for Successful Investing (Eleventh Edition),Burton G. Malkiel
"If you find yourself lucky enough to be in the highest federal tax bracket, you will find tax-exempt money-market funds to be the best vehicle for your reserve funds.",A Random Walk Down Wall Street: The Time-Tested Strategy for Successful Investing (Eleventh Edition),Burton G. Malkiel
take advantage of every opportunity to make your savings tax-deductible,A Random Walk Down Wall Street: The Time-Tested Strategy for Successful Investing (Eleventh Edition),Burton G. Malkiel
"My advice is to save as much as you can through these tax-sheltered means. Use up any other savings you may have for current living expenses,",A Random Walk Down Wall Street: The Time-Tested Strategy for Successful Investing (Eleventh Edition),Burton G. Malkiel
High investment rewards can be achieved only at the cost of substantial risk-taking.,A Random Walk Down Wall Street: The Time-Tested Strategy for Successful Investing (Eleventh Edition),Burton G. Malkiel
"In all likelihood, your sleeping point will be greatly influenced by the way a loss would affect your financial survival.",A Random Walk Down Wall Street: The Time-Tested Strategy for Successful Investing (Eleventh Edition),Burton G. Malkiel
"Finally, real estate returns seem to be higher than stock returns during periods when inflation is accelerating,",A Random Walk Down Wall Street: The Time-Tested Strategy for Successful Investing (Eleventh Edition),Burton G. Malkiel
"Finally, real estate returns seem to be higher than stock returns during periods when inflation is accelerating, but do less well during periods of disinflation.",A Random Walk Down Wall Street: The Time-Tested Strategy for Successful Investing (Eleventh Edition),Burton G. Malkiel
"zero coupons or simply zeros because owners receive no periodic interest payments, as they do in a regular interest-coupon-paying bond.",A Random Walk Down Wall Street: The Time-Tested Strategy for Successful Investing (Eleventh Edition),Burton G. Malkiel
"I suggest that you buy new issues rather than already outstanding securities. New-issue yields are usually a bit sweeter than the yields of seasoned outstanding bonds, and you avoid paying transactions charges on new issues.",A Random Walk Down Wall Street: The Time-Tested Strategy for Successful Investing (Eleventh Edition),Burton G. Malkiel
"risk within reasonable bounds by sticking with issues rated at least A by Moody’s and Standard & Poor’s rating services. Also consider so-called AMT bonds. These bonds are subject to the alternative minimum (income) tax and, therefore, are not attractive to individuals who have sheltered a significant part of their income from tax. But if you are not subject to the alternative minimum tax, you can get some extra yield from holding AMT bonds. There is one nasty “heads I win, tails you lose” feature of bonds. If interest rates go up, the price of your bonds will go down. But if interest rates go down, the issuer can often “call” the bonds away from you (repay the debt early) and then issue new bonds at lower rates.",A Random Walk Down Wall Street: The Time-Tested Strategy for Successful Investing (Eleventh Edition),Burton G. Malkiel
keep your risk within reasonable bounds by sticking with issues rated at least A by Moody’s and Standard & Poor’s rating services.,A Random Walk Down Wall Street: The Time-Tested Strategy for Successful Investing (Eleventh Edition),Burton G. Malkiel
"protect yourself, make sure that your long-term bonds have a ten-year call-protection provision",A Random Walk Down Wall Street: The Time-Tested Strategy for Successful Investing (Eleventh Edition),Burton G. Malkiel
I recommend such a partial substitution of stocks for bonds in that part of the portfolio designed for lower risk and more stability.,A Random Walk Down Wall Street: The Time-Tested Strategy for Successful Investing (Eleventh Edition),Burton G. Malkiel
Practically all gold trading is for the purpose of hoarding or speculating so that the bullion can be sold later at a higher price.,A Random Walk Down Wall Street: The Time-Tested Strategy for Successful Investing (Eleventh Edition),Burton G. Malkiel
I would also steer clear of hedge-fund and private-equity and venture-capital funds.,A Random Walk Down Wall Street: The Time-Tested Strategy for Successful Investing (Eleventh Edition),Burton G. Malkiel
"When interest rates are low, stocks, which compete with bonds for an investor’s savings, tend to sell at low dividend yields and high price-earnings multiples.",A Random Walk Down Wall Street: The Time-Tested Strategy for Successful Investing (Eleventh Edition),Burton G. Malkiel
"Firms that buy back stock tend to reduce the number of shares outstanding and therefore increase earnings per share and, thus, share prices.",A Random Walk Down Wall Street: The Time-Tested Strategy for Successful Investing (Eleventh Edition),Burton G. Malkiel
"stock returns are determined by (1) the initial dividend yield at which the stocks were purchased, (2) the growth rate of earnings, and (3) changes in valuation in terms of price-earnings (or price-dividend) ratios.",A Random Walk Down Wall Street: The Time-Tested Strategy for Successful Investing (Eleventh Edition),Burton G. Malkiel
bond returns are determined by (1) the initial yield to maturity at which the bonds were purchased and (2) changes in interest rates (yields) and therefore in bond prices for bond investors who do not hold to maturity.,A Random Walk Down Wall Street: The Time-Tested Strategy for Successful Investing (Eleventh Edition),Burton G. Malkiel
CAPEs do a reasonably good job of forecasting returns a decade ahead and confirm the expectation presented here of modest single-digit returns over the years ahead.,A Random Walk Down Wall Street: The Time-Tested Strategy for Successful Investing (Eleventh Edition),Burton G. Malkiel
A specific need must be funded with specific assets dedicated to that need.,A Random Walk Down Wall Street: The Time-Tested Strategy for Successful Investing (Eleventh Edition),Burton G. Malkiel
"Nevertheless, even in one’s late sixties, I suggest that 40 percent of the portfolio be committed to ordinary common stocks and 15 percent to real estate equities (REITs) to give some income growth to cope with inflation.",A Random Walk Down Wall Street: The Time-Tested Strategy for Successful Investing (Eleventh Edition),Burton G. Malkiel
how much can you spend if you want to be sure that your money will last as long as you do? I suggested in previous editions that you use “the 4 percent solution.”,A Random Walk Down Wall Street: The Time-Tested Strategy for Successful Investing (Eleventh Edition),Burton G. Malkiel
"The general rule is: First estimate the return of the investment fund, and then deduct the inflation rate to determine the sustainable level of spending.",A Random Walk Down Wall Street: The Time-Tested Strategy for Successful Investing (Eleventh Edition),Burton G. Malkiel
buy shares in various broad-based index funds or indexed ETFs designed to track the different classes of stocks that make up your portfolio.,A Random Walk Down Wall Street: The Time-Tested Strategy for Successful Investing (Eleventh Edition),Burton G. Malkiel
"I believe that if an investor is to buy only one U.S. index fund, the best general U.S. index to emulate is one of the broader indexes such as the Russell 3000, the Wilshire 5000 Total Market Index,",A Random Walk Down Wall Street: The Time-Tested Strategy for Successful Investing (Eleventh Edition),Burton G. Malkiel
One of the biggest mistakes that investors make is to fail to obtain sufficient international diversification.,A Random Walk Down Wall Street: The Time-Tested Strategy for Successful Investing (Eleventh Edition),Burton G. Malkiel
"Look for growth situations that the market has not already recognized by bidding the stock’s multiple to a large premium. If the growth actually takes place, you will often get a double bonus—both",A Random Walk Down Wall Street: The Time-Tested Strategy for Successful Investing (Eleventh Edition),Burton G. Malkiel
investors need to put more China into their portfolios than is available in general world or emerging-market index funds.,A Random Walk Down Wall Street: The Time-Tested Strategy for Successful Investing (Eleventh Edition),Burton G. Malkiel
I suggest that investors never buy actively managed funds with expense ratios above 50 basis points (½ of 1 percent) and with turnover of more than 50 percent.,Emotional Intelligence,Daniel Goleman
Those who are at the mercy of impulse—who lack self-control—suffer a moral deficiency:,Emotional Intelligence,Daniel Goleman
There is growing evidence that fundamental ethical stances in life stem from underlying emotional capacities.,Emotional Intelligence,Daniel Goleman
ability to control impulse is the base of will and character.,Emotional Intelligence,Daniel Goleman
"if there are any two moral stances that our times call for, they are precisely these, self-restraint and compassion.",Emotional Intelligence,Daniel Goleman
Our genetic heritage endows each of us with a series of emotional set-points that determines our temperament. But the brain circuitry involved is extraordinarily malleable; temperament is not destiny.,Emotional Intelligence,Daniel Goleman
"Aristotle saw, the problem is not with emotionality, but with the appropriateness of emotion and its expression.",Emotional Intelligence,Daniel Goleman
Intelligence can come to nothing when the emotions hold sway.,Emotional Intelligence,Daniel Goleman
"emotion is motere, the Latin verb ""to move,"" plus the prefix ""e-"" to connote ""move away,"" suggesting that a tendency to act is implicit in every emotion.",Emotional Intelligence,Daniel Goleman
"One is an act of the emotional mind, the other of the rational mind.",Emotional Intelligence,Daniel Goleman
she is sad despite her words to the contrary is an act of comprehending just as surely as is distilling meaning from words on a printed page.,Emotional Intelligence,Daniel Goleman
"feelings are essential to thought, thought to feeling.",Emotional Intelligence,Daniel Goleman
there was an emotional brain long before there was a rational one.,Emotional Intelligence,Daniel Goleman
"The larger the number of such connections, the greater the range of possible responses.",Emotional Intelligence,Daniel Goleman
"The neocortex allows for the subtlety and complexity of emotional life, such as the ability to have feelings about our feelings.",Getting the Love You Want--A Guide for Couples--,"Harville Hendrix, Ph.D."
couples fight because they “object to difference.”,Getting the Love You Want--A Guide for Couples--,"Harville Hendrix, Ph.D."
to recover the sensations of being fully alive and joyfully connecting with which we came into the world.,Getting the Love You Want--A Guide for Couples--,"Harville Hendrix, Ph.D."
to experience with the partner the same sensations they experienced with their caretakers.,Getting the Love You Want--A Guide for Couples--,"Harville Hendrix, Ph.D."
"When we fall in love, this unconscious, trapped in the eternal now and having only a dim awareness of the outside world, is trying to re-create the environment of childhood.",Getting the Love You Want--A Guide for Couples--,"Harville Hendrix, Ph.D."
we expect our partners to intuit our unmet needs and satisfy them without asking for anything in return.,Getting the Love You Want--A Guide for Couples--,"Harville Hendrix, Ph.D."
Your brain is changed every time you interact with others.,Getting the Love You Want--A Guide for Couples--,"Harville Hendrix, Ph.D."
"building a new freeway beside an old highway—once people travel on the freeway, they spend less time on the old, narrow road.",Getting the Love You Want--A Guide for Couples--,"Harville Hendrix, Ph.D."
"When you have more and more positive interactions, the pathway intensifies. Meanwhile, the old and disruptive pathway that was created in your childhood loses its strength",Getting the Love You Want--A Guide for Couples--,"Harville Hendrix, Ph.D."
spending some time sharing your childhood experiences is vital because it gives you a better understanding of your partner’s inner reality and helps you shift from judgment to curiosity and empathy.,Getting the Love You Want--A Guide for Couples--,"Harville Hendrix, Ph.D."
"For the child who experienced intrusive parents, in later years, she becomes an isolator, a person who unconsciously pushes others away.",Getting the Love You Want--A Guide for Couples--,"Harville Hendrix, Ph.D."
"We try to fill this emptiness with food and drugs and activities, but what we yearn for is the joyful connection and the sensation of feeling fully alive that we experienced as very young children.",Getting the Love You Want--A Guide for Couples--,"Harville Hendrix, Ph.D."
the person you are most likely to fall in love with is someone who has both the positive and the negative traits of your parents!,Getting the Love You Want--A Guide for Couples--,"Harville Hendrix, Ph.D."
Being in love is like becoming the favored child in an idealized family.,Getting the Love You Want--A Guide for Couples--,"Harville Hendrix, Ph.D."
"When you and I lit our lamps and took our first objective look at our lovers, we discovered that they weren’t gods at all—they were imperfect humans, full of warts and blemishes, all those negative traits that we had denied.",Getting the Love You Want--A Guide for Couples--,"Harville Hendrix, Ph.D."
people don’t get involved in a love relationship to satisfy their partner’s needs—they do so to further their own psychological and emotional well-being.,Getting the Love You Want--A Guide for Couples--,"Harville Hendrix, Ph.D."
"But to a therapist, global words like always and never are an indication of a childhood wound.",Getting the Love You Want--A Guide for Couples--,"Harville Hendrix, Ph.D."
"When partners don’t tell each other what they want and constantly criticize each other for not giving it to them, it’s no wonder that a rupture forms in the relationship.",Getting the Love You Want--A Guide for Couples--,"Harville Hendrix, Ph.D."
"This was standard problem-oriented, conflict-resolving, contractual relationship counseling.",Getting the Love You Want--A Guide for Couples--,"Harville Hendrix, Ph.D."
"At the end of each session, we would help them negotiate a contract that would specify an agreed-upon course of action.",Getting the Love You Want--A Guide for Couples--,"Harville Hendrix, Ph.D."
"It is easier to tackle a difficult project if you divide it into small, manageable tasks.",Getting the Love You Want--A Guide for Couples--,"Harville Hendrix, Ph.D."
"To help couples overcome their resistance to narrowing their exits, we rely on the principle known as graduated change.2",Getting the Love You Want--A Guide for Couples--,"Harville Hendrix, Ph.D."
"WHEN YOU ACCEPT the limited nature of your own perceptions and become more receptive to the truth of your partner’s perceptions,",Getting the Love You Want--A Guide for Couples--,"Harville Hendrix, Ph.D."
